{
  "job_id": "2026-03-07-0141-diet-luffy-001",
  "current_stage": "luffy_research",
  "status": "running",
  "retry_count": 0,
  "next_agent": "luffy",
  "blocking_reason": null,
  "last_error": null,
  "selected_item": null,
  "artifacts": {
    "research": "/home/solpi/work/blog-automation/jobs/2026-03-07-0141-diet-luffy-001/artifacts/research.json",
    "validation": "/home/solpi/work/blog-automation/jobs/2026-03-07-0141-diet-luffy-001/artifacts/validation.json",
    "draft": "/home/solpi/work/blog-automation/jobs/2026-03-07-0141-diet-luffy-001/artifacts/draft.md",
    "final": "/home/solpi/work/blog-automation/jobs/2026-03-07-0141-diet-luffy-001/artifacts/final.md",
    "publish": "/home/solpi/work/blog-automation/jobs/2026-03-07-0141-diet-luffy-001/artifacts/publish.json"
  },
  "updated_at": "2026-03-07T01:41:30+09:00"
}
