{
  "job_id": "2026-03-07-0308-duzzonku-luffy-001",
  "current_stage": "done",
  "status": "completed",
  "retry_count": 0,
  "next_agent": "none",
  "blocking_reason": null,
  "last_error": null,
  "selected_item": {
    "numbers": [
      6,
      8
    ]
  },
  "artifacts": {
    "research": "/home/solpi/work/blog-automation/jobs/2026-03-07-0308-duzzonku-luffy-001/artifacts/research.json",
    "validation": "/home/solpi/work/blog-automation/jobs/2026-03-07-0308-duzzonku-luffy-001/artifacts/validation.json",
    "draft": "/home/solpi/work/blog-automation/jobs/2026-03-07-0308-duzzonku-luffy-001/artifacts/draft.md",
    "final": "/home/solpi/work/blog-automation/jobs/2026-03-07-0308-duzzonku-luffy-001/artifacts/final.md",
    "publish": "/home/solpi/work/blog-automation/jobs/2026-03-07-0308-duzzonku-luffy-001/artifacts/publish.json"
  },
  "updated_at": "2026-03-07T03:22:58+09:00"
}