{
  "job_id": "2026-03-07-0347-jjajang-luffy-001",
  "current_stage": "ace_validation",
  "status": "pending",
  "retry_count": 0,
  "next_agent": "ace",
  "blocking_reason": null,
  "last_error": null,
  "selected_item": {
    "numbers": [1]
  },
  "artifacts": {
    "research": "/home/solpi/work/blog-automation/jobs/2026-03-07-0347-jjajang-luffy-001/artifacts/research.json",
    "validation": "/home/solpi/work/blog-automation/jobs/2026-03-07-0347-jjajang-luffy-001/artifacts/validation.json",
    "draft": "/home/solpi/work/blog-automation/jobs/2026-03-07-0347-jjajang-luffy-001/artifacts/draft.md",
    "final": "/home/solpi/work/blog-automation/jobs/2026-03-07-0347-jjajang-luffy-001/artifacts/final.md",
    "publish": "/home/solpi/work/blog-automation/jobs/2026-03-07-0347-jjajang-luffy-001/artifacts/publish.json"
  },
  "updated_at": "2026-03-07T03:49:20+09:00"
}
