{
  "job_id": "2026-03-07-0402-diet-luffy-002",
  "current_stage": "ace_validation",
  "status": "failed_blocking",
  "retry_count": 0,
  "next_agent": "nere",
  "blocking_reason": "hard_gate_failed:partner_link_generated_or_best_reviews",
  "last_error": null,
  "selected_item": {
    "numbers": [
      1,
      6
    ]
  },
  "artifacts": {
    "research": "/home/solpi/work/blog-automation/jobs/2026-03-07-0402-diet-luffy-002/artifacts/research.json",
    "validation": "/home/solpi/work/blog-automation/jobs/2026-03-07-0402-diet-luffy-002/artifacts/validation.json",
    "draft": "/home/solpi/work/blog-automation/jobs/2026-03-07-0402-diet-luffy-002/artifacts/draft.md",
    "final": "/home/solpi/work/blog-automation/jobs/2026-03-07-0402-diet-luffy-002/artifacts/final.md",
    "publish": "/home/solpi/work/blog-automation/jobs/2026-03-07-0402-diet-luffy-002/artifacts/publish.json"
  },
  "updated_at": "2026-03-07T09:13:20+09:00"
}